KNOT_ID,Title,Problem_Statement,Scope,Status,Owner_AoR,Stakeholders,Residual_Before,Residual_Target,Dependencies,Target_Close_Date
KNOT-GAIA-DPP-96-001,DPP schema definition,Canonical data schema for Digital Product Passports covering all GAIA component classes undefined,"In: DPP field definitions, enumerations; Out: external regulatory schemas",OPEN,STK_SE,STK_SAF;STK_CERT;STK_OPS,100,10,KNOT-GAIA-MISS-001;KNOT-GAIA-GOV-001,2026-07-31
KNOT-GAIA-DPP-96-002,Ledger architecture (hash-chain vs DAG),Trade between SHA-256 hash-chain append-only ledger and DAG-based distributed ledger not resolved,"In: ledger subsystem; Out: verification & audit interfaces",OPEN,STK_SE,STK_SAF;STK_CERT;STK_TEST,100,10,KNOT-GAIA-DPP-96-001;KNOT-GAIA-GOV-001,2026-08-31
KNOT-GAIA-DPP-96-003,Component provenance tracking,Provenance recording from raw-material certificates through manufacturing test and delivery undefined,"In: material certs, inspection records; Out: assembly DPP roll-up",OPEN,STK_SE,STK_SAF;STK_TEST,100,15,KNOT-GAIA-DPP-96-001;KNOT-GAIA-DPP-96-002,2026-09-30
KNOT-GAIA-DPP-96-004,Lifecycle event recording,Event taxonomy and recording protocol for installation maintenance inspection and replacement undefined,"In: event taxonomy, sensor feeds; Out: operational DPP timeline",OPEN,STK_OPS,STK_SE;STK_CERT;STK_TEST,100,5,KNOT-GAIA-DPP-96-001,2026-07-15
KNOT-GAIA-DPP-96-005,Cross-domain interoperability,DPP data exchange format and API contracts across GAIA subsystems undefined,"In: subsystem DPP interfaces; Out: unified query/export API",OPEN,STK_SE,STK_OPS;STK_PMO,100,10,KNOT-GAIA-MISS-001;KNOT-GAIA-DPP-96-001;KNOT-GAIA-DPP-96-002,2026-10-31
KNOT-GAIA-DPP-96-006,Audit & compliance reporting,Regulatory audit trail generation and export-control (ITAR/EAR) DPP overlay undefined,"In: audit & compliance rules; Out: exportable compliance packages",OPEN,STK_CERT,STK_SE;STK_SAF;STK_OPS,100,5,KNOT-GAIA-DPP-96-004;KNOT-GAIA-DPP-96-005,2026-11-30
